{"attempt_id":"screening-a1","bindings":[{"admission_ref":{"id":"blob:be2920080d6e8f6bc3c8a1627db42a76d1c6eb6a6eecc895d98e71a627c81741","sha256":"be2920080d6e8f6bc3c8a1627db42a76d1c6eb6a6eecc895d98e71a627c81741"},"declaration_ref":{"id":"blob:c77ce64a119ef4a54100ea17b59422a5971afe95db8ccf822929320b7bbafbf7","sha256":"c77ce64a119ef4a54100ea17b59422a5971afe95db8ccf822929320b7bbafbf7"},"dependency_refs":[],"effective_authority":{"network":"none","network_allowlist":[],"resource_reads":[{"id":"blob:1f8f0e2f036d7b8d629ec8241e7279e71b60f43c66ab95ce04be37d6af8602e5","sha256":"1f8f0e2f036d7b8d629ec8241e7279e71b60f43c66ab95ce04be37d6af8602e5"},{"id":"blob:6ae083ab26207a1c1b0985da2265546733b6226e9831edd859a904fdaefb88fc","sha256":"6ae083ab26207a1c1b0985da2265546733b6226e9831edd859a904fdaefb88fc"}],"tools":[],"write_roots":[]},"id":"screening.verifier.opportunity_card.binding","implementation_refs":[{"id":"blob:be6b075f91153106c45ba535e0ec97fdbb901442e490ea494fc648b4c6ea9c6b","sha256":"be6b075f91153106c45ba535e0ec97fdbb901442e490ea494fc648b4c6ea9c6b"},{"id":"blob:89018d720c6ce3dffdcd4da1da6af0af39e1e45ee951e4f8bb12b9095d0251c8","sha256":"89018d720c6ce3dffdcd4da1da6af0af39e1e45ee951e4f8bb12b9095d0251c8"}],"limits":{"memory_mb":16384,"model_calls":1,"time_s":60},"role":"verifier"}],"checking_profile_ref":{"id":"blob:d724b6bdd40e2e34e2f8c7011ca8f658710c87344dc10b827669db0159cd5143","sha256":"d724b6bdd40e2e34e2f8c7011ca8f658710c87344dc10b827669db0159cd5143"},"configuration_ref":{"id":"blob:4f73598206a5d8e16f11c9fd401c4e40097592268629488de14018fa7d3b8e4b","sha256":"4f73598206a5d8e16f11c9fd401c4e40097592268629488de14018fa7d3b8e4b"},"evidence_obligations":["captured_input_and_output","invocation_observation","mandatory_checks","semantic_assessment","independently_budgeted_check_observation"],"id":"subnode:c6d1bcdf5f884f669e63ae7c7230fcae","input_refs":[{"id":"blob:1f8f0e2f036d7b8d629ec8241e7279e71b60f43c66ab95ce04be37d6af8602e5","sha256":"1f8f0e2f036d7b8d629ec8241e7279e71b60f43c66ab95ce04be37d6af8602e5"},{"id":"blob:6ae083ab26207a1c1b0985da2265546733b6226e9831edd859a904fdaefb88fc","sha256":"6ae083ab26207a1c1b0985da2265546733b6226e9831edd859a904fdaefb88fc"}],"inputs":[{"artifact_refs":[{"id":"blob:1f8f0e2f036d7b8d629ec8241e7279e71b60f43c66ab95ce04be37d6af8602e5","sha256":"1f8f0e2f036d7b8d629ec8241e7279e71b60f43c66ab95ce04be37d6af8602e5"}],"contract_id":"capsule-declaration","name":"subject_declaration","required":true,"version":"1.0.0"},{"artifact_refs":[{"id":"blob:6ae083ab26207a1c1b0985da2265546733b6226e9831edd859a904fdaefb88fc","sha256":"6ae083ab26207a1c1b0985da2265546733b6226e9831edd859a904fdaefb88fc"}],"contract_id":"opaque-bytes","name":"subject_output","required":true,"version":"1.0.0"}],"node_contract_ref":{"id":"blob:bb8d6538e1d161dcb6a1f8035397c386ad14ace34855b3d061deabedd333bec9","sha256":"bb8d6538e1d161dcb6a1f8035397c386ad14ace34855b3d061deabedd333bec9"},"node_id":"screening","objective":"The selected opportunity will preserve the requested logistic regression comparison and attached-data constraints.","outputs":[{"contract_id":"urn:jiuwenswarm:m1-design:verifier-assessment:1.0.0","name":"verifier_assessment","required":true,"version":"1.0.0"}],"policy_ref":{"id":"blob:91c7eccd63977fb5b76f1eeb5f28046b79c8021a919d4258af80e874b38956b6","sha256":"91c7eccd63977fb5b76f1eeb5f28046b79c8021a919d4258af80e874b38956b6"},"required_outputs":["verifier_assessment"],"requirement_ids":["requirement-001","requirement-002"],"revision":1,"run_id":"run:ed6087d37f4742aaba2b0435a1f91841","schema_version":"1.0.0","subnode_id":"screening.verifier.opportunity_card","subnode_limits":{"memory_mb":16384,"model_calls":1,"time_s":60},"template_ref":{"id":"template:36b29f2927374620afa43126d3fa8695","sha256":"6c78df126d7e1ec0fc7482ac1b755f2ba7ca01c5a9ca65eaa808eedf04d0679c"}}