{"attempt_id":"intention_compiler-a1","bindings":[{"admission_ref":{"id":"blob:be2920080d6e8f6bc3c8a1627db42a76d1c6eb6a6eecc895d98e71a627c81741","sha256":"be2920080d6e8f6bc3c8a1627db42a76d1c6eb6a6eecc895d98e71a627c81741"},"declaration_ref":{"id":"blob:c77ce64a119ef4a54100ea17b59422a5971afe95db8ccf822929320b7bbafbf7","sha256":"c77ce64a119ef4a54100ea17b59422a5971afe95db8ccf822929320b7bbafbf7"},"dependency_refs":[],"effective_authority":{"network":"none","network_allowlist":[],"resource_reads":[{"id":"blob:84b40893e3a9ad514ea06bcc7311a66b1f4f8318313985b3171adffdd90d3604","sha256":"84b40893e3a9ad514ea06bcc7311a66b1f4f8318313985b3171adffdd90d3604"},{"id":"blob:2673b2ab1ccf53ff5da395f2b388d62e47e197e27c0c8e0b7f37395d193fb56e","sha256":"2673b2ab1ccf53ff5da395f2b388d62e47e197e27c0c8e0b7f37395d193fb56e"}],"tools":[],"write_roots":[]},"id":"requirements.verifier.binding","implementation_refs":[{"id":"blob:be6b075f91153106c45ba535e0ec97fdbb901442e490ea494fc648b4c6ea9c6b","sha256":"be6b075f91153106c45ba535e0ec97fdbb901442e490ea494fc648b4c6ea9c6b"},{"id":"blob:89018d720c6ce3dffdcd4da1da6af0af39e1e45ee951e4f8bb12b9095d0251c8","sha256":"89018d720c6ce3dffdcd4da1da6af0af39e1e45ee951e4f8bb12b9095d0251c8"}],"limits":{"memory_mb":16384,"model_calls":1,"time_s":60},"role":"verifier"}],"checking_profile_ref":{"id":"blob:80cfbe2d14f0e1953a7acb18f029b97c6da51ea31b929acf62187718f0aec501","sha256":"80cfbe2d14f0e1953a7acb18f029b97c6da51ea31b929acf62187718f0aec501"},"configuration_ref":{"id":"blob:4f73598206a5d8e16f11c9fd401c4e40097592268629488de14018fa7d3b8e4b","sha256":"4f73598206a5d8e16f11c9fd401c4e40097592268629488de14018fa7d3b8e4b"},"evidence_obligations":["captured_input_and_output","invocation_observation","mandatory_checks","semantic_assessment","independently_budgeted_check_observation"],"id":"subnode:73f5fa5bdfd94b0eac2756f809bc130e","input_refs":[{"id":"blob:84b40893e3a9ad514ea06bcc7311a66b1f4f8318313985b3171adffdd90d3604","sha256":"84b40893e3a9ad514ea06bcc7311a66b1f4f8318313985b3171adffdd90d3604"},{"id":"blob:2673b2ab1ccf53ff5da395f2b388d62e47e197e27c0c8e0b7f37395d193fb56e","sha256":"2673b2ab1ccf53ff5da395f2b388d62e47e197e27c0c8e0b7f37395d193fb56e"}],"inputs":[{"artifact_refs":[{"id":"blob:84b40893e3a9ad514ea06bcc7311a66b1f4f8318313985b3171adffdd90d3604","sha256":"84b40893e3a9ad514ea06bcc7311a66b1f4f8318313985b3171adffdd90d3604"}],"contract_id":"capsule-declaration","name":"subject_declaration","required":true,"version":"1.0.0"},{"artifact_refs":[{"id":"blob:2673b2ab1ccf53ff5da395f2b388d62e47e197e27c0c8e0b7f37395d193fb56e","sha256":"2673b2ab1ccf53ff5da395f2b388d62e47e197e27c0c8e0b7f37395d193fb56e"}],"contract_id":"opaque-bytes","name":"subject_output","required":true,"version":"1.0.0"}],"node_contract_ref":{"id":"blob:3c3e96ae006654b688bdebf8040c5bb2ccce3d68ba2755bdfb20437d58e9ff76","sha256":"3c3e96ae006654b688bdebf8040c5bb2ccce3d68ba2755bdfb20437d58e9ff76"},"node_id":"intention_compiler","objective":"Compile qualified user meaning into an accepted Research Brief","outputs":[{"contract_id":"urn:jiuwenswarm:m1-design:verifier-assessment:1.0.0","name":"verifier_assessment","required":true,"version":"1.0.0"}],"policy_ref":{"id":"blob:91c7eccd63977fb5b76f1eeb5f28046b79c8021a919d4258af80e874b38956b6","sha256":"91c7eccd63977fb5b76f1eeb5f28046b79c8021a919d4258af80e874b38956b6"},"required_outputs":["verifier_assessment"],"requirement_ids":["qualified_intent","research_brief"],"revision":1,"run_id":"run:6cfba611e7ef4f42b3fa3451a8573245","schema_version":"1.0.0","subnode_id":"requirements.verifier","subnode_limits":{"memory_mb":16384,"model_calls":1,"time_s":60},"template_ref":{"id":"template:c6fdc55a5e3f48e7b8aa9b81bf43b4cd","sha256":"e7dcf189bf8c007bee6078bec93fc9c6480830fc2285f0423613d3274ef51d9e"}}